{
 "schema_version": 1,
 "id": "esp32-p4",
 "name": "ESP32-P4 (RISC-V)",
 "gpios": [
  "G0",
  "G1",
  "G2",
  "G3",
  "G4",
  "G5",
  "G6",
  "G7",
  "G8",
  "G9",
  "G10",
  "G11",
  "G12",
  "G13",
  "G14",
  "G15",
  "G16",
  "G17",
  "G18",
  "G19",
  "G20",
  "G21",
  "G22",
  "G23",
  "G24",
  "G25",
  "G26",
  "G27",
  "G28",
  "G29",
  "G30",
  "G31",
  "G32",
  "G33",
  "G34",
  "G35",
  "G36",
  "G37",
  "G38",
  "G39",
  "G40",
  "G41",
  "G42",
  "G43",
  "G44",
  "G45",
  "G46",
  "G47",
  "G48",
  "G49",
  "G50",
  "G51",
  "G52",
  "G53",
  "G54"
 ],
 "rules": [
  {
   "id": "strapping",
   "effect": "caution",
   "pins": [
    "G34",
    "G35",
    "G36",
    "G37",
    "G38"
   ],
   "text": "strapping pin: its level at reset selects the boot mode",
   "src": [
    "idf-gpio-esp32p4"
   ],
   "confidence": "high",
   "last_verified": "2026-10-04"
  },
  {
   "id": "usb_jtag",
   "effect": "caution",
   "pins": [
    "G24",
    "G25"
   ],
   "text": "USB Serial/JTAG by default; reusing them disables USB flashing and the console",
   "src": [
    "idf-gpio-esp32p4"
   ],
   "confidence": "high",
   "last_verified": "2026-10-04"
  }
 ]
}
